{
  "benchmark_id": "fiction-role-benchmark-v1.1",
  "pack_version": "1.1.0",
  "role": "researcher",
  "blind_alias": "CANDIDATE-006",
  "scorer_id": "SCOUT-BLIND-REVIEWER-001",
  "rubric_scores": {
    "evidence_verdict_accuracy": 24,
    "citation_integrity": 25,
    "evidence_inference_separation": 20,
    "qualification_and_uncertainty": 15,
    "production_usefulness": 10
  },
  "human_total": 94,
  "deterministic_penalty": 4,
  "final_score": 90,
  "critical_flags": [],
  "evidence": [
    "R1–R4 match the closed evidence; R5 uses “not-established” instead of the harness ground-truth “contradicted,” despite correctly rejecting proof of supernatural action.",
    "Every material assessment cites exactly one valid supporting packet source and no outside citation.",
    "Every item separates “evidence” from “inference” cleanly.",
    "Limitations explicitly preserve uncertainty around water source, alarm identity/action, and compass cause/bearing.",
    "The output is concise, ordered R1–R5, and immediately usable."
  ],
  "scored_at": "2026-08-10T10:50:30+10:00",
  "confidence": 0.9
}
