{
  "benchmark_id": "fiction-role-benchmark-v1.1",
  "pack_version": "1.1.0",
  "role": "editor",
  "blind_alias": "CANDIDATE-002",
  "scorer_id": "SCOUT-BLIND-REVIEWER-001",
  "rubric_scores": {
    "diagnosis_accuracy_and_priority": 24,
    "surgical_improvement": 24,
    "voice_and_event_preservation": 20,
    "scope_discipline_and_restraint": 19,
    "editorial_record_quality": 9
  },
  "human_total": 96,
  "deterministic_penalty": 0,
  "final_score": 96,
  "critical_flags": [],
  "evidence": [
    "The three diagnoses target repeated physical information, explained fear, and an abstractly stated choice using exact source evidence.",
    "The revision retains 98.25% of source word volume while sharpening the same events rather than replacing the scene.",
    "Protected sentences and all required event markers survive; no new lore or plot resolution appears.",
    "The forbidden cliché is removed through local action/body evidence, not a scene rewrite.",
    "Preservation is declared accurately; no deferred issue was silently expanded beyond the supplied passage."
  ],
  "scored_at": "2026-08-10T11:14:08+10:00",
  "confidence": 0.9
}
